{
  "schema_version": "1.0.0",
  "queue_id": "dq_example_000001",
  "observed_retailer_id": "walmart_us",
  "observed_brand_raw": "Example Brand",
  "observed_brand_normalized": "example_brand",
  "observed_product_title": "Example Brand Organic Eggs 12 ct",
  "observed_url": "https://www.walmart.com/ip/example",
  "observed_domain": "walmart.com",
  "observed_at": "2026-08-11T12:00:00Z",
  "source_collection": "search_monitor",
  "source_job_id": "job_example",
  "proposed_brand_bucket": "Candidate/Unknown",
  "proposed_brand_class": "candidate_unknown",
  "proposed_canonical_brand_id": null,
  "evidence_type": ["isolated_search_observation"],
  "evidence_count": 1,
  "exclusivity_signal": "unknown",
  "distributor_signal": null,
  "retailer_brand_page_signal": false,
  "first_party_source_url": null,
  "confidence_score": 25,
  "duplicate_candidate_of": null,
  "review_status": "Pending",
  "reviewer": null,
  "reviewed_at": null,
  "decision": null,
  "decision_notes": null
}
